{
  "schema_version": 2,
  "id": "EXCEPTION-998",
  "record_version": "1.0.0",
  "status": "closed",
  "conformance_status": "resolved",
  "constitution_version": "1.0.0",
  "constitutional_provision": "principle.architecture-live",
  "justification": "Synthetic closed exception fixture",
  "scope": "Synthetic fixture only",
  "creates_precedent": false,
  "approval_policy": "ordinary",
  "owner_id": "governance.architect",
  "approval_ids": ["approval.synthetic-architect"],
  "starts_at": "2026-01-01T10:00:00Z",
  "expires_at": "2026-01-15T10:00:00Z",
  "remediation_work_order_id": "WORK-009",
  "affected_component_ids": ["governance.synthetic-component"],
  "affected_contract_ids": ["contract.governance-schema"],
  "affected_capability_ids": [],
  "risks": ["Synthetic risk"],
  "compensating_controls": ["Synthetic compensating control"],
  "closure_criteria": "Synthetic remediation is complete",
  "reversal": "Remove the synthetic exception",
  "status_history": [
    {"from": "proposed", "to": "active", "at": "2026-01-01T10:00:00Z"},
    {"from": "active", "to": "closed", "at": "2026-01-10T10:00:00Z"}
  ],
  "closure": {
    "at": "2026-01-10T10:00:00Z",
    "reason": "Synthetic remediation completed",
    "approval_ids": ["approval.synthetic-closure"]
  }
}
